,title,score
847,russias stranglehold on the nuclear power cycle,25.0
848,dogs brain activity shows they recognize the names of objects,8.0
849,grep by example interactive guide,11.0
850,openjdk project wakefield  the wayland desktop for jdk on linux video,28.0
851,hacker news rankings graphs of hn posts rank on timeline,126.0
852,optimizing javascript for fun and for profit,9.0
853,us salaries are surging for inoffice jobs,17.0
854,programmers will be among the first ones obsoleted by their own revolution2017,10.0
855,ask hn who runs the spam bots and why,15.0
856,my custom home automation system,17.0
857,antithesis of a oneinamillion bug taming demonic nondeterminism,136.0
858,would you pay for a phone built for you,6.0
859,a nostalgic look back at when the internet still felt joyful,103.0
860,why the 2 inflation target 2023,257.0
861,show hn joblander  chrome extension for realtime job interview hints,18.0
862,mozilla fixes 100k firefox zerodays following twoday hackathon,14.0
863,show hn turn a video of an app into a functional prototype with claude opus,17.0
864,intel announces 36b oregon investment following federal funding commitments,5.0
865,unionbusters 1986,37.0
866,florida is about to erase climate change from most of its laws,4.0
867,spains high court orders block on telegram app as a precautionary measure,35.0
868,lumen a lisp for lua and javascript,12.0
869,gdpr enforcement tracker  list of gdpr fines,81.0
870,removal of bentazone using activated carbon from spent coffee grounds,16.0
871,qualcomm announces snapdragon 8s gen 3 a cheaper chip for premium phones,13.0
872,boeing ceo calhoun to step down at end of 2024,200.0
873,americas climate boomtowns are waiting rising temps and migration,17.0
874,pregnancy advances your biological age  but giving birth turns it back,11.0
875,apache nuttx implementing ondemand paging,6.0
876,tell hn it is now impossible to dismiss shorts from your youtube feed,38.0
877,experiments with bitnet 15 ngmi,11.0
878,empty backpacks activate the immune system against cancer in mice,84.0
879,is earlyonset cancer an emerging global epidemic 2022,21.0
880,sheets of graph paper were used to design super mario bros 2016,58.0
881,the smartphone kids are not all right,34.0
882,animals behaving differently how humans affect wildlife,4.0
883,sisu  documents structuring publishing in multiple formats and search,15.0
884,wine 95 dev  run windows applications on linux bsd solaris and macos,19.0
885,approximation of the claude 3 tokenizer by inspecting generation stream,9.0
886,timeline of the far future,6.0
887,rollercoaster tycoon at 25 its mindblowing how it inspired me,150.0
888,who owns what in nyc,66.0
889,a microsoft excel spreadsheet from hell slowed williams f1 cars for years,9.0
890,ask hn better alternatives than passwords,10.0
891,flipper blackhat a linuxbased wifi tool,18.0
892,portscanning the fleet and trying to put out fires,14.0
893,ask hn how can i block promotional sms from contacts without numbersexdprom,6.0
894,ask hn how to run an oldschool mailing list,65.0
895,nearly 5m animals dead in mongolias harshest winter in half a century,19.0
896,spacex forced workers to sign illegal severance agreements us agency claims,101.0
897,the limits to growth 1972,19.0
898,tetris reversed is unearthed after being forgotten for a decade,12.0
899,if you dont change the ui nobody notices 2009,16.0
900,pandas arent all black and white some come in a different shade,7.0
901,01 light a voice interface for your home computer,21.0
902,framerate fiends plot murder spree of rpgs inconsequential  cpuhungry npcs,6.0
903,china blocks use of intel and amd chips in government computers report,143.0
904,linux 69 adds new buildtime control whether to authorize attached usb devices,3.0
905,microsoft vs mikerowesoft 2004,49.0
906,how to actually use the notes you take,83.0
907,astronomers confirm a new trojan asteroid that shares an orbit with mars,4.0
908,us is easing vehicle emissions rules timeline for allelectric vehicle adoption,12.0
909,us kleenex plant contaminated drinking water with pfas lawsuit says,32.0
910,the final act fears that us journalism crisis could destabilize 2024 election,14.0
911,apples iphone is not a monopoly like windows was a monopoly,17.0
912,mistral ai announce 7b v02 base model release,34.0
913,cargo thefts spiked 68 in q4 led by food and beverage freight,29.0
914,oils 0210  flags integers starship bug and speed,4.0
915,decoding the plant worlds complex biochemical communication networks,16.0
916,why freakonomics failed to transform economics,72.0
917,microsoft paper intros autonomous ai framework turning devs into supervisors,15.0
918,microsoft reuses its openai playbook with inflection takeover,19.0
919,boeing ceo to step down in major reshuffle at embattled plane maker,16.0
920,step aside influencers  were now in the era of deinfluencing,13.0
921,china blocks use of intel and amd chips in government computers ft reports,15.0
922,us marriages back to prepandemic levels while divorce rate falls,30.0
923,linux 69 will boot much faster for systems with large amounts of ram,5.0
924,gemini on the iphone would be ais mainstream moment,30.0
925,in continued defense of nonfrequentist probabilities,18.0
926,anglish times,3.0
927,something exceptionally grim is happening on the internet,75.0
928,nvidias breakthrough ai chip defies physics video,7.0
929,the deepfake porn of kids and celebrities that gets views,5.0
930,boeing ceo to step down,7.0
931,my diy nas adventure,10.0
932,fans quitting spotify to save their love of music 2022,86.0
933,minecraft exploit is allowing attackers to get any xboxms account banned,23.0
934,chatgpt linked to declining academic performance and memory loss in new study,8.0
935,the greatest energy boom youve never heard of,10.0
936,why isnt dental health considered primary medical care,105.0
937,show hn kafbat ui for apache kafka v10 is out,46.0
938,antimatter propulsion pdf,88.0
939,apple turned on discoverable by others you might want it off,52.0
940,ask hn textbook regarding llms,11.0
941,reddit faces new reality after cashing in on its ipo,14.0
942,4 internal apple emails that helped the doj build its case,30.0
943,startech unveils 15in1 thunderbolt 4usb4 dock with quad display support,55.0
944,hipe  the highperformance erlang project,8.0
945,gm stops sharing driver data with brokers amid backlash,99.0
946,unpatchable security flaw in apple silicon macs breaks encryption,12.0
947,killed by tech,11.0
948,ec2 instance pricing,12.0
949,the irs has an answer to turbotax,59.0
950,noland arbaugh first neuralink patient qa video,12.0
951,judge throws out elon musks x lawsuit against nonprofit,7.0
952,sure let adobe ai scan all of your documents what could go wrong,60.0
953,robert fripp announces king crimson supergroup beat,17.0
954,its causing them to drop out of life how phones warped gen z,8.0
955,pets vs cattle and how to use the analogy properly 2016,4.0
956,toxic rare earth mining industry at the heart of the green energy transition,37.0
957,boeing ceo dave calhoun to step down in wake of 737 max struggles,36.0
958,kids today cant read  even college kids the bitesizing of books,23.0
959,if you watched certain youtube videos investigators demanded your data,85.0
960,tea get rewards for open source contributions,5.0
961,the false promise of carbon capture as a climate solution,6.0
962,evolution of click farm fraud,5.0
963,ask hn did cpu in the past mattered as much as dlllm dev between nvda and amd,7.0
964,show hn using llms to research reddit to help decide what to buy,15.0
965,russian military used hacked cameras in missile strike on capital,5.0
966,large grocers took advantage of pandemic supply chain disruptions ftc finds,52.0
967,big auto is begging governments to let them go bankrupt as chinese evs loom,5.0
968,designing a pure python web framework,116.0
969,google apple breakups on the agenda as regulators target tech,17.0
970,the secret weapon of bash power users,21.0
971,national park service sued over new nocash policy at national parks,37.0
972,ask hn any good fuzzer for grpc,10.0
973,three body problem review benioff and weiss netflix debut is a brutal dud,9.0
974,bunk beds in aircraft cabins the realistic prospects,59.0
975,redis changes license from bsd3 to dual rsalv2ssplv1,38.0
976,are we all trapped in the matrix 25 years later,45.0
977,sonomas lost versions bug what it is and how to safeguard versions,9.0
978,a modest proposal no smartphones for kids,6.0
979,tiny corp changes course yet again with plans to offer amd radeon gpus,13.0
980,ask hn has anyone else lost access to instagram,8.0
981,blizzard locks you out  new eula no ownership forced arbitration video,9.0
982,nintendo emulator suyu removed from gitlab following dmca request,62.0
983,coffee associated w reduced risk of colorectal cancer returnallcause mortality,17.0
