,title,score
429,its official europe turns to the falcon 9 to launch its navigation satellites,147.0
430,oral bacterium migrates to gut helps colorectal tumors grow,19.0
431,time to upgrade your monitor,28.0
432,pine64 march update making waves,119.0
433,18f css coding styleguide,16.0
434,migration out of africa may have been driven by first glaciation of pleistocene,63.0
435,if you are using llm rag  you should be doing raft,51.0
436,waking my computer from afar,60.0
437,neuralink patient controls games by thinking during interview,194.0
438,fault tolerance and resilience patterns for go,7.0
439,time spent on computer linked to increased chance of erectile dysfunction,15.0
440,the new inflection,193.0
441,fbi sent several informants to standing rock protests court documents show,55.0
442,apple scraps plan to design display for watch inhouse cuts jobs,7.0
443,parkinsons disease can now be detected through the skin,18.0
444,ask hn reference applications to idiomatically learn languagesframeworks,5.0
445,the highrisk refactoring,70.0
446,allegations of criminality by boeing in deceased whistleblower complaint,88.0
447,show hn filebased cache for slow python functions,73.0
448,long covid brain fog may be due to damaged blood vessels in the brain,224.0
449,ask hn how to change jobs with almost no interviewing experience,73.0
450,car is spying on you for insurance companies,8.0
451,encyclopaedia britannica seeking 1b valuation in ipo,62.0
452,mars after midnight  lucas popes new gloriously weird happy dad game,14.0
453,history of uniform random number generation 2017 pdf,57.0
454,state farm discontinuing 72000 home policies in california,21.0
455,gcc compiler adds support for device offloading with amd rdna3 apus,22.0
456,we were wizards  a foreword to learning perl 1993,193.0
457,global prediction of extreme floods in ungauged watersheds,3.0
458,redict is an independent copyleft fork of redis,43.0
459,apples iphone is not a monopoly like windows was a monopoly,7.0
460,new studies suggest millions with mild cognitive impairment go undiagnosed,29.0
461,tableflow,8.0
462,20 years of not even wrong,282.0
463,z85 format for representing binary data as printable text,57.0
464,nvidia announces moonshot to create embodied humanlevel ai in robot form,7.0
465,trusting content on the kde store,49.0
466,greece argentina and india are the fastest improving business environments,63.0
467,zxaaanet  collection of zx spectrum demos with video,11.0
468,politicians who voted to ban tiktok may own as much as 126m in tech stocks,27.0
469,apt archive mirrors in gitlfs,14.0
470,analysis of competing hypotheses,9.0
471,the plight of japans ama divers,24.0
472,reverse engineering of a russian missile electronic board video,3.0
473,stanford matheducation expert has reckless disregard for accuracy,27.0
474,a type of bacteria that causes dental plaque was found in 50 of colon cancers,123.0
475,debloat nonrooted android devices,303.0
476,android 12 changing wallpaper or dark theme breaks flutter and jetpack apps,5.0
477,irish names youre probably saying wrong and how to pronounce them,61.0
478,show hn outofthebox text classification models,20.0
479,xray inspection in the semiconductor industry,3.0
480,obsidian sync now starts at 4 per month with the new standard plan,15.0
481,tell hn ynab will partly remove direct bank imports,10.0
482,framerate fiends plot murder spree of rpgs inconsequential  cpuhungry npcs,5.0
483,us battery storage smashes deployment records in q4 2023,13.0
484,css2wind  a minigame to learn tailwind css,3.0
485,general motors quits sharing driving behavior with data brokers,70.0
486,microsoft is giving copilot users access to gpt4turbo for free,75.0
487,man lives 10 mo without recurrence after groundbreaking glioblastoma treatment,30.0
488,imitation learning 2023,86.0
489,show hn 3dgscpp  performant cross platform gaussian splatting with vulkan,50.0
490,apple removed alexei navalnys app after kremlin demand,91.0
491,bats of the midnight sun,34.0
492,flagship nasa space telescope faces a pennypinching death,19.0
493,toxmax rocket concept  lithium kept molten by radioactive cesium137,22.0
494,how we get high our bodies are perfectly primed for consuming cannabis,20.0
495,fujitsu says it found malware on its network warns of possible data breach,32.0
496,torcs for reinforcement learning,26.0
497,llms rag vs finetuning,35.0
498,reddits ipo is a regrettable misstep in corporate governance,27.0
499,the brewintosh a 3d printed fullsize macintosh video,65.0
500,radios how do they work,141.0
501,googles first tensor processing unit architecture,218.0
502,nonlinearsolvejl fast and robust solvers for nonlinear equations in julia,41.0
503,zenhammer rowhammer attacks on amd zenbased platforms,262.0
504,packetediting games in golang 2021,11.0
505,show hn tracecat  opensource security alert automation  soar alternative,180.0
506,kapaai yc s23 is hiring a full stack engineer with llm focus,1.0
507,moirai a time series foundation model for universal forecasting,92.0
508,i asked chatgpt to write the code to print hello world  as a junior developer,42.0
509,martin scorseses secret life as an obsessive vhs archivist,180.0
510,canva acquires affinity its biggest acquisition to compete with adobe,98.0
511,deej an opensource hardware volume mixer for windows and linux,29.0
512,writing x86 simd using x86incasm 2017,22.0
513,two open source projects with great architecture documentation,227.0
514,friends dont let friends export to csv,136.0
515,electronic project kits hands on with a vintage 160in1 2016,106.0
516,the francis scott key bridge in baltimore maryland has collapsed,9.0
517,notes on debugging hotspots jit compilation 2023,23.0
518,a new way ebola replicates,15.0
519,show hn invertornotcom  api to enhance your images in darkmode,120.0
520,show hn autogenerate an openapi spec by listening to localhost,149.0
521,unlocking the secrets of myelin repair,51.0
522,velox metas unified execution engine pdf,87.0
523,inkjets are for more than just printing,101.0
524,computing with javascripts undefined 2020,18.0
525,cfengines star trek and ai origins 2023,51.0
526,solving crew battle strategy with math,56.0
527,see a fish ring the bell,208.0
528,computational astronomy exploring the cosmos with wolfram,43.0
529,how to trade software for small money,26.0
530,scientists rename genes to stop microsoft excel from misreading them as dates,20.0
531,telegrams peertopeer sms login service is a privacy nightmare,4.0
532,why is the linkedin app almost half a gig,66.0
533,lifelong disadvantage how socioeconomics affect brain function,59.0
534,boeing demands virgin galactic destroy all data from failed partnership,3.0
535,for brilliant color packaging the first lsd blotter,181.0
536,chess puzzle but you are what you capture,53.0
537,show hn jampack  optimizes static websites as a postprocessing step,274.0
538,welcome to canva affinity,18.0
539,how to criticize computer scientists,17.0
540,commission opens noncompliance investigations against alphabet apple and meta,535.0
541,nix at scale,32.0
542,houdini and the art of escape 2020,20.0
543,publishers secure widespread support in copyright battle with internet archive,61.0
544,hidden files in c64 os,81.0
545,william adams english advisor to the shogun,95.0
546,volunteer for the fsf and gnu,16.0
547,the semiconductor industry hinges on a quartz factory in north carolina,121.0
548,hospitals are adding billions in facility fees for routine care,8.0
549,repairing a buggy board arcade machine,71.0
550,debtrelated drivers license suspensions in ohio,110.0
551,turbocall  justintime compiler for deno ffi,86.0
552,bump allocation up or down,91.0
553,portscanning the fleet and trying to put out fires,99.0
554,exosuit muscle control steps closer to reality,87.0
555,in bflat,10.0
556,tiktok regulation bills future looking wobbly in senate as calls,13.0
557,designing the light source for iris,9.0
558,laurent de brunhoff babar the elephant author died,29.0
559,show hn detecting adblock without javascript by abusing http 103 responses,96.0
560,sidebar on metaknowledge,17.0
561,hotel hotspot hijinks,50.0
562,show hn deploysolo  the saas boilerplate for engineers pocketbase htmx,26.0
563,when did dogs become our best friends,141.0
564,drinking bird toys upgraded to generate clean energy from water,15.0
565,donglehider framework laptop expansion card,224.0
566,symbolics sunstone development plan 1987 pdf,49.0
567,show hn faviconhelper,28.0
568,barcelonas sagrada familia will be completed in 2026,458.0
569,tcp connection timeout mystery,121.0
570,jasmin paris first woman to complete gruelling barkley marathons race,36.0
571,supervision reusable computer vision,225.0
572,interoception the inner sense driving your thoughts,18.0
573,show hn flatito grep for yaml and json files,55.0
574,the immortal jellyfish 2015,56.0
575,a strip mine threatens a natural treasure the okefenokee in georgia,35.0
576,realtime map of every starlink satellite in orbit,291.0
577,using jtag to dump parallel nor flash,59.0
578,vast archive of rare japanese textbooks now online to explore free,32.0
579,ftx to sell 884m of anthropic shares to two dozen institutional investors,27.0
580,everyone is john a competitive roleplaying game for three or more people,25.0
581,pyenv  lets you easily switch between multiple versions of python,241.0
582,ugly avatar,273.0
583,fisker trading suspended by nyse,34.0
584,illness impacting dairy cattle is confirmed as highly pathogenic avian flu,77.0
585,speeding up azure development by not using terraform,69.0
586,telegrams peertopeer login system is a risky way to save 5 a month,11.0
587,pschess  a chess engine in postscript,199.0
588,show hn nanoweb  a low latency one binary webserver designed for serving spas,148.0
589,new aztec codices discovered the codices of san andrés tetepilco,368.0
590,federation is the future of social media says bluesky ceo jay graber,33.0
591,broadcasting lora packets wihout a radio,13.0
592,scientists have traced human tail loss to a short sequence of genetic code,185.0
593,the üü conundrum,172.0
594,meta takes 40k holds our business ransom,143.0
595,spqr 130 a productionready system for horizontal scaling of postgresql,177.0
596,microsoft has a new windows and surface chief,8.0
597,monolith  cli tool for saving complete web pages as a single html file,723.0
598,uk says china state actor apt31 targeted parliamentarians,30.0
599,fake aigenerated books swarm amazon,29.0
600,opera sees big jump in eu users on ios android after dma update,95.0
601,all teslas in the us get a one month trial of fsd starting this week,7.0
602,netherlands is the secondlargest exporter of agricultural products,27.0
603,conspiratorialism and the epistemological crisis,7.0
604,the case of a leaky goroutine,69.0
605,hacker fakes german ministers fingerprints using photos of her hands 2014,58.0
606,twitterx has lost its lawsuit against the center for countering digital hate,76.0
607,tinyssh is a small ssh server using nacl tweetnacl,314.0
608,longer genes may drive aging,3.0
609,redis switches licenses acquires speedb,38.0
610,judge dismisses elon musks suit against hate speech researchers,40.0
611,doubts grow about the biosignature approach to alienhunting,107.0
612,show hn latitude  developerfirst embedded analytics,7.0
613,lezer a parsing system for codemirror inspired by treesitter,156.0
614,adam neumann submits bid to buy back wework for more than 500m,26.0
615,the eider keepers,18.0
616,moving back to london and 2023 review,53.0
617,time to examine the anatomy of the british library ransomware nightmare,27.0
618,the private and public seductions of the biggest pop neuroscientist,10.0
619,you can have two big things but not three,5.0
620,why choose asyncawait over threads,402.0
621,the lifetime tooth decay vaccine is now available in honduras,47.0
622,sqlite schema diagram generator,513.0
623,the lost worlds of telnet 2019,84.0
624,newly detailed tycoon 2fa phishing kit bypasses multifactor authentication,3.0
625,creating an autopilot in xplane using python,159.0
626,why isnt preprint review being adopted,67.0
627,what happens to google maps when tectonic plates move 2020,247.0
628,ask hn what do yall make of netflixs 3 body problem,25.0
629,maps that show time instead of space,138.0
630,cfos tackle thorny calculus on gen ai whats the return on investment,9.0
631,arm64ec and arm64x explained,116.0
632,openai sora first impressions,72.0
633,game of life simulating itself infinitely zoomable,1491.0
634,inclusive sans text font designed for accessibility and readability,62.0
635,weather planning for eclipse day,152.0
636,the unlisted how people without an address are stripped of their basic rights,5.0
637,gerbil scheme  a lisp for the 21st century,174.0
638,the mirror godot bashed game engine,91.0
639,aegis v30  a free secure and open source 2fa app for android,344.0
640,all us teslas getting 1 month fsd trial this week,7.0
641,swedish court rules meteorite should stay with owner of property where it landed,33.0
642,how does single signon sso work,43.0
643,winnipeg man was member of chinese military cyber branch,22.0
644,c left arrow operator 2016,161.0
645,why fuzzing over formal verification,60.0
646,emergent abilities in llms actually develop gradually and predictably  study,250.0
647,what techies keep getting wrong about industrial automation,35.0
648,stmicro announces ultralowpower stm32u0 mcu,5.0
649,the expressive power of transformers with chain of thought revised,19.0
650,d2 playground,143.0
651,a spark extinguished,224.0
652,marimo interactive fluffy ball,165.0
653,the enchanting blossom explosion of jacaranda trees in mexico city,55.0
654,reverse dns ipv4 map,198.0
655,feedle a search engine for blogs and podcasts,285.0
656,the 10yearold golden boy faustino oro beat magnus carlsen yesterday,25.0
657,the format dialog in windows nt,229.0
658,flickr commons,15.0
659,cbd products dont ease pain and are potentially harmful  new study finds,19.0
660,is gpt4 a good data analyst 2023,60.0
661,northern lights forecasted to be visible into upper united states tonight,129.0
662,the man who bought pine bluff arkansas 2022,285.0
663,hyprland crash course,115.0
664,show hn rotary phone project,201.0
665,show hn glossarie  a new immersive way to learn a language,342.0
666,context the missing feature of programming languages,81.0
667,un security council passes ceasefire resolution,17.0
668,2000 lines of code 2007,254.0
669,stealing strategies from cancerous t cells may boost immunotherapy,7.0
670,show hn lapdev a new opensource remote dev environment management software,223.0
671,step aside influencers  were now in the era of deinfluencing,16.0
672,shes bouncing the ball  the uncanny way octopuses play,147.0
673,zeal os,53.0
674,nist personal identity verification piv of federal employees and contractors,113.0
675,for the love of cats in turkey,69.0
676,the what why and how of containers,16.0
677,after 2 weeks of testing what do developers think about claude 3,33.0
678,nigerian fintech zone raises 85m to scale decentralized payment infrastructure,6.0
679,bertie  a minimal highassurance implementation of tls 13 written in hacspec,135.0
680,as ai booms land near nuclear power plants becomes hot real estate,53.0
681,livebook elixirs swiss army knife,41.0
682,the html hobbyist on neocities,10.0
683,globotipo making a typeface that is seen by 100m people daily,17.0
684,vcard and rss as an alternative to social media,176.0
685,dvd formatlogo licensing program will be terminated at the end of 2024,31.0
686,show hn codel  autonomous open source ai developer agent,47.0
687,show hn jumprun  aipowered research as interactive canvases,33.0
688,recess open source interactive rss aggregator,26.0
689,how chainofthought reasoning helps neural networks compute,266.0
690,show hn turn tailwind into editable wordpress block styles  build sites faster,15.0
691,the woodpecker in heat that attacked and delayed a space shuttle,31.0
692,the invention of writing on rapa nui easter island,13.0
693,denseformer enhancing information flow in transformers,123.0
694,mutt on windows without wsl,99.0
695,best engineering interview question ive gotten,175.0
696,pure css website,241.0
697,scenescript a novel approach for 3d scene reconstruction,131.0
698,launch hn drymerge yc w24  automate workflows with plain english,174.0
699,emad mostaque resigned as ceo of stability ai,505.0
700,ask hn books about sales for indie hackers and small saas businesses,33.0
701,from fullstack development to systems programming,23.0
702,steve wozniak says hes taking his youtube lawsuit as far as he can 3m video,21.0
703,the lone volcano in californias central valley,64.0
704,mapping almost every law regulation and case in australia,399.0
705,show hn wirequery  fullstack session replay and more,78.0
706,linux crisis tools,569.0
707,toolbx tool for interactive command line environments on linux,22.0
708,typesafe printf in typescript,94.0
709,neofetch for git repositories,7.0
710,do artifacts have politics pdf,64.0
711,meteorite selftest checklist,77.0
712,interval parsing grammars for file format parsing 2023 pdf,62.0
713,looking at the atari 400 part 1  by paul lefebvre,16.0
714,geothermal is the hottest thing in clean energy,9.0
715,3rd gen clickfarm tech illustrated,16.0
716,speaking without vocal cords thanks to a new aiassisted wearable device,120.0
717,show hn fxyt  tiny esoteric stackbased postfix canvas colouring language,81.0
718,pack a new container format for compressed files,195.0
719,exploring gleam with genetic algorithms,5.0
720,chronos learning the language of time series,207.0
721,soupault a static website management tool,127.0
722,fundamentals of object storage in elixir,122.0
723,picotron is a fantasy workstation,668.0
724,marketrate housing will make your city cheaper,42.0
725,after 41 years my first assembly program on my first computer the tomy tutor,143.0
726,the reitoff principle why you should add nothing to your worklife schedule,127.0
727,show hn leaping  debug python tests instantly with an llm debugger,120.0
728,the linux kerneltask_delayacct sysctl and why you might care about it,21.0
729,the intel 8088 processors instruction prefetch circuitry a look inside,183.0
730,analog computing can solve complex equations and use far less energy,41.0
731,climaticaware terrain generation with geological sketch guidance,5.0
732,an approach to design highpower lithium sulfur batteries,39.0
733,ask hn how to find a fullfilling career after a data science job,16.0
734,silent running 1970s environmental fable remains depressingly all too relevant,197.0
735,on microsoft the us government must embrace the stick,101.0
736,beyond headlines of transmitted alzheimers scientists see case for prions,56.0
737,core i9 14900kf breaks world record almost achieves 91ghz 2023,100.0
738,monitorian windows desktop tool to adjust monitor brightness,37.0
739,an introductory 44bsd interprocess communication tutorial pdf 1986,42.0
740,micron samples 256 gb ddr58800 mcr dimms modules for servers,98.0
741,algorithmic mathematical art 2004,162.0
742,visiting scarfolk the most spectacular dystopia of the 1970s 2016,307.0
743,the nakedcpu hardware experiments and a roadmap for navigating documentation pdf,20.0
744,man changes name to literally anybody else and announces us presidential run,38.0
745,how to harvest moisture from the atmosphere,41.0
746,ask hn learning maths from the ground up,24.0
747,hexagons and hilbert curves  the headaches of distributed spatial indices,88.0
748,oxide cloud computer no cables no assembly just cloud,145.0
749,kuru mystery disease left entire papua new guinean villages without women,17.0
750,fewer people using elon musks x as it struggles to keep users,23.0
751,study higher gut bacteria diversity associated with lower risk of infection,29.0
752,bugs in games that have become features,4.0
753,uk blames china for breach of voter data,7.0
754,my grandfather paul tillich the unbelieving theologian,110.0
755,toaruos has been archived,17.0
756,rare photos reveal the vibrant culture of cowboy saloons in the 19th century,90.0
757,boom announces successful flight of xb1 demonstrator aircraft,475.0
758,show hn interesting use cases for ai characters with arthasai,6.0
759,stop your car from spying on you,31.0
760,explorer explorationguided reasoning for textual reinforcement learning,25.0
761,germanys solar panel industry once a leader is getting squeezed,85.0
762,the future of electric vehicles at the zero emissions fleet event video,9.0
763,scilab  numerical computation for engineers and scientists,15.0
764,web apps or mobile apps for solopreneur,13.0
765,highspeed microscale 3d printing,73.0
766,vasopressin deficiency driver of social impairment and fluid imbalance in asd pdf,135.0
767,howto document the documentation system,38.0
768,elon musks x loses lawsuit against research group,19.0
769,boston built a ton of lab buildings now many are empty,32.0
770,cuda is still a giant moat for nvidia,84.0
771,how ml model data poisoning works in 5 minutes,65.0
772,opencat opensource robotic pet quadruped framework,268.0
773,shakespeares sister digital archives reveal insights into unknown sibling,71.0
774,scientists traced a mysterious covid case back to six toilets,106.0
775,apollo data uncovers lunar seismic events,86.0
776,duckdb as the new jq,362.0
777,show hn clai  openai models brought to the terminal,8.0
778,a return to bluray as streaming value evaporates,310.0
779,the internet was better when it was terrible,15.0
780,show hn free plaintext bookmarking,168.0
781,show hn love ruby but meh daily standups dsu you might like my gem,15.0
782,cataloguing my vinyl collection with computer vision  james coffee blog,20.0
783,apex legends players worried about rce flaw after algs hacks,3.0
784,ntex powerful pragmatic fast framework for composable networking services,40.0
785,employer review site glassdoor deanonymized users without consent,217.0
786,be more lucky,104.0
787,longest sustained rise in people too sick to work since 1990s says thinktank,49.0
788,google ordered to identify who watched certain youtube videos,542.0
789,ask hn best way to set up selfmanaged postgres clusters,25.0
790,super memory why emily nash is sharing her brain with science,147.0
791,6g terahertz devices demand 3d electronics,21.0
792,butterflies full of wasps full of microwasps are a science nightmare 2021,14.0
793,stop disable the scanning of documents by adobe ai solutions,40.0
794,show hn magickcss  minimalist css for wizards,297.0
795,2k earthquakes in 1 day off canada coast,136.0
796,fb internal thrift over http removed my phone  how is this possible 2022,32.0
797,the origins of the generic mapping tools,51.0
798,programming of human stem cells into components of blood vessels,13.0
799,amazon offering 5 credit for old cloud cams,17.0
800,show hn vtcc tiny c compiler translated to v,3.0
801,treatment of glaucoma with natural products and their mechanism of action 2022,6.0
802,evga power supply kills 22tb of customer storage then denies responsibility,108.0
803,mirantis k8s lens closed its source,35.0
804,efinix titanium ti375 fpga offers quadcore hardened riscv pcie gen 4 10gbe,42.0
805,safecast open radiation and air quality map,48.0
806,launch hn soundry ai yc w24  music sample generator for music creators,171.0
807,one of the largest eruptions in earths history could have wiped out humans,4.0
808,why is it so hard to build an airport,261.0
809,googles aipowered search results are loaded with spammy scammy garbage,19.0
810,the bulma css framework reaches 10,239.0
811,postquantum cryptography is too damn big,166.0
812,mozilla drops onerep after ceo admits to running peoplesearch networks,323.0
813,trump joins bloombergs 500 wealthiest after truth social merger,12.0
814,jan an open source alternative to chatgpt that runs on the desktop,193.0
815,what happens when a fifteen year old pumps and dumps with a net profit of 800k 2002,176.0
816,finding little albert 2011,24.0
817,jasmin paris becomes first woman to finish hardest race,198.0
818,the elements of differentiable programming,131.0
819,uk imposes sanctions after chinesebacked cyberattacks,4.0
820,reactive programming without functions,64.0
821,ask hn if the singularity is nigh why be frugal,18.0
822,show hn pgjq use jq in postgres,39.0
823,tokyo  salary expectations,13.0
824,build time is a collective responsibility,28.0
825,simulating weighted automata over sequences and trees with transformers,3.0
826,show hn memories  foss google photos alternative built for high performance,788.0
827,first tesla cybertruck teardown shows botched door hinge install,33.0
828,instagram limits political content by default,23.0
829,cwerg clike language that can be implemented in 10kloc,49.0
830,ant queens cannibalise infected brood to limit disease spread recycle nutrients,42.0
831,junk proteins identified as one cause of aging and possible source of als,23.0
832,hyperreality short film depicting the future of ar video,21.0
833,show hn send messages to all users in a subreddit thread,12.0
834,windows 98 icons 2015,208.0
835,an introduction to modern cmake,60.0
836,tcltk 90,41.0
837,microsoft launches surface laptop 6 for business and surface pro 10,72.0
838,show hn dalmatian  text2sql that works,44.0
839,a cargo ships windwing sails saved it up to 12 tons of fuel per day,83.0
840,china blocks use of intel and amd chips in government computers,84.0
841,first rule of extreme dishwasher loading club is think quality not quantity,27.0
842,talking on the moon the quest to establish a lunar mobile phone network,4.0
843,bought a new lexus  cant get a second key for 35 months,8.0
844,halo cme detected  associated with x1 flare on 23 march utcday,11.0
845,show hn askvideosvideoclip opensource videotext embedding model,9.0
846,google will start showing aipowered search results for users who didnt optin,114.0
