title,score
fans quitting spotify to save their love of music 2022,86
minecraft exploit is allowing attackers to get any xboxms account banned,23
chatgpt linked to declining academic performance and memory loss in new study,8
the greatest energy boom youve never heard of,10
why isnt dental health considered primary medical care,105
show hn kafbat ui for apache kafka v10 is out,46
antimatter propulsion pdf,88
apple turned on discoverable by others you might want it off,52
ask hn textbook regarding llms,11
reddit faces new reality after cashing in on its ipo,14
4 internal apple emails that helped the doj build its case,30
startech unveils 15in1 thunderbolt 4usb4 dock with quad display support,55
hipe  the highperformance erlang project,8
gm stops sharing driver data with brokers amid backlash,99
unpatchable security flaw in apple silicon macs breaks encryption,12
killed by tech,11
ec2 instance pricing,12
the irs has an answer to turbotax,59
noland arbaugh first neuralink patient qa video,12
judge throws out elon musks x lawsuit against nonprofit,7
sure let adobe ai scan all of your documents what could go wrong,60
robert fripp announces king crimson supergroup beat,17
its causing them to drop out of life how phones warped gen z,8
pets vs cattle and how to use the analogy properly 2016,4
toxic rare earth mining industry at the heart of the green energy transition,37
boeing ceo dave calhoun to step down in wake of 737 max struggles,36
kids today cant read  even college kids the bitesizing of books,23
if you watched certain youtube videos investigators demanded your data,85
tea get rewards for open source contributions,5
the false promise of carbon capture as a climate solution,6
evolution of click farm fraud,5
ask hn did cpu in the past mattered as much as dlllm dev between nvda and amd,7
show hn using llms to research reddit to help decide what to buy,15
russian military used hacked cameras in missile strike on capital,5
large grocers took advantage of pandemic supply chain disruptions ftc finds,52
big auto is begging governments to let them go bankrupt as chinese evs loom,5
designing a pure python web framework,116
google apple breakups on the agenda as regulators target tech,17
the secret weapon of bash power users,21
national park service sued over new nocash policy at national parks,37
ask hn any good fuzzer for grpc,10
three body problem review benioff and weiss netflix debut is a brutal dud,9
bunk beds in aircraft cabins the realistic prospects,59
redis changes license from bsd3 to dual rsalv2ssplv1,38
are we all trapped in the matrix 25 years later,45
sonomas lost versions bug what it is and how to safeguard versions,9
a modest proposal no smartphones for kids,6
tiny corp changes course yet again with plans to offer amd radeon gpus,13
ask hn has anyone else lost access to instagram,8
blizzard locks you out  new eula no ownership forced arbitration video,9
nintendo emulator suyu removed from gitlab following dmca request,62
coffee associated w reduced risk of colorectal cancer returnallcause mortality,17
