title,score
we were wizards  a foreword to learning perl 1993,193.0
global prediction of extreme floods in ungauged watersheds,3.0
redict is an independent copyleft fork of redis,43.0
apples iphone is not a monopoly like windows was a monopoly,7.0
new studies suggest millions with mild cognitive impairment go undiagnosed,29.0
tableflow,8.0
20 years of not even wrong,282.0
z85 format for representing binary data as printable text,57.0
nvidia announces moonshot to create embodied humanlevel ai in robot form,7.0
trusting content on the kde store,49.0
greece argentina and india are the fastest improving business environments,63.0
zxaaanet  collection of zx spectrum demos with video,11.0
politicians who voted to ban tiktok may own as much as 126m in tech stocks,27.0
apt archive mirrors in gitlfs,14.0
analysis of competing hypotheses,9.0
the plight of japans ama divers,24.0
reverse engineering of a russian missile electronic board video,3.0
stanford matheducation expert has reckless disregard for accuracy,27.0
a type of bacteria that causes dental plaque was found in 50 of colon cancers,123.0
debloat nonrooted android devices,303.0
android 12 changing wallpaper or dark theme breaks flutter and jetpack apps,5.0
irish names youre probably saying wrong and how to pronounce them,61.0
show hn outofthebox text classification models,20.0
xray inspection in the semiconductor industry,3.0
obsidian sync now starts at 4 per month with the new standard plan,15.0
tell hn ynab will partly remove direct bank imports,10.0
framerate fiends plot murder spree of rpgs inconsequential  cpuhungry npcs,5.0
us battery storage smashes deployment records in q4 2023,13.0
css2wind  a minigame to learn tailwind css,3.0
general motors quits sharing driving behavior with data brokers,70.0
microsoft is giving copilot users access to gpt4turbo for free,75.0
man lives 10 mo without recurrence after groundbreaking glioblastoma treatment,30.0
imitation learning 2023,86.0
show hn 3dgscpp  performant cross platform gaussian splatting with vulkan,50.0
apple removed alexei navalnys app after kremlin demand,91.0
bats of the midnight sun,34.0
flagship nasa space telescope faces a pennypinching death,19.0
toxmax rocket concept  lithium kept molten by radioactive cesium137,22.0
how we get high our bodies are perfectly primed for consuming cannabis,20.0
fujitsu says it found malware on its network warns of possible data breach,32.0
torcs for reinforcement learning,26.0
llms rag vs finetuning,35.0
reddits ipo is a regrettable misstep in corporate governance,27.0
the brewintosh a 3d printed fullsize macintosh video,65.0
